{
  "blinding": {
    "candidate_outputs_included": false,
    "construction_tags_included": false,
    "control_outputs_included": false
  },
  "cases": [
    {
      "case_id": "rsv1-001",
      "metadata": {
        "environment": "development",
        "requirements_state": "complete",
        "requires_interaction": false,
        "risk": "low",
        "task_type": "implementation"
      },
      "oracle_eligible": {
        "routing.interaction_required": true,
        "routing.semantic_risk": true,
        "routing.task_class": true
      },
      "task": "Add input validation to the JSON import endpoint and return field-specific errors."
    },
    {
      "case_id": "rsv1-002",
      "metadata": {
        "environment": "development",
        "requirements_state": "complete",
        "requires_interaction": false,
        "risk": "normal",
        "task_type": "implementation"
      },
      "oracle_eligible": {
        "routing.interaction_required": true,
        "routing.semantic_risk": true,
        "routing.task_class": true
      },
      "task": "Implement an LRU cache for parsed configuration files with a bounded entry count."
    },
    {
      "case_id": "rsv1-003",
      "metadata": {
        "environment": "development",
        "requirements_state": "complete",
        "requires_interaction": false,
        "risk": "normal",
        "task_type": "implementation"
      },
      "oracle_eligible": {
        "routing.interaction_required": true,
        "routing.semantic_risk": true,
        "routing.task_class": true
      },
      "task": "Add pagination support to the repository search API while preserving the existing response shape."
    },
    {
      "case_id": "rsv1-004",
      "metadata": {
        "environment": "development",
        "requirements_state": "complete",
        "requires_interaction": false,
        "risk": "normal",
        "task_type": "implementation"
      },
      "oracle_eligible": {
        "routing.interaction_required": true,
        "routing.semantic_risk": true,
        "routing.task_class": true
      },
      "task": "Implement idempotency keys for duplicate webhook deliveries in the local event processor."
    },
    {
      "case_id": "rsv1-005",
      "metadata": {
        "environment": "development",
        "requirements_state": "complete",
        "requires_interaction": false,
        "risk": "low",
        "task_type": "implementation"
      },
      "oracle_eligible": {
        "routing.interaction_required": true,
        "routing.semantic_risk": true,
        "routing.task_class": true
      },
      "task": "Add a command-line flag that emits the current configuration as sanitized JSON."
    },
    {
      "case_id": "rsv1-006",
      "metadata": {
        "environment": "development",
        "requirements_state": "complete",
        "requires_interaction": false,
        "risk": "normal",
        "task_type": "implementation"
      },
      "oracle_eligible": {
        "routing.interaction_required": true,
        "routing.semantic_risk": true,
        "routing.task_class": true
      },
      "task": "Implement retry backoff for transient database connection failures."
    },
    {
      "case_id": "rsv1-007",
      "metadata": {
        "environment": "development",
        "requirements_state": "complete",
        "requires_interaction": false,
        "risk": "normal",
        "task_type": "implementation"
      },
      "oracle_eligible": {
        "routing.interaction_required": true,
        "routing.semantic_risk": true,
        "routing.task_class": true
      },
      "task": "Add a migration that introduces a nullable display_name column and update the model mapping."
    },
    {
      "case_id": "rsv1-008",
      "metadata": {
        "environment": "development",
        "requirements_state": "complete",
        "requires_interaction": false,
        "risk": "normal",
        "task_type": "implementation"
      },
      "oracle_eligible": {
        "routing.interaction_required": true,
        "routing.semantic_risk": true,
        "routing.task_class": true
      },
      "task": "Implement CSV export for the existing filtered results view."
    },
    {
      "case_id": "rsv1-009",
      "metadata": {
        "environment": "development",
        "requirements_state": "complete",
        "requires_interaction": false,
        "risk": "low",
        "task_type": "implementation"
      },
      "oracle_eligible": {
        "routing.interaction_required": true,
        "routing.semantic_risk": true,
        "routing.task_class": true
      },
      "task": "Add a deterministic normalization step for user-supplied repository paths."
    },
    {
      "case_id": "rsv1-010",
      "metadata": {
        "environment": "development",
        "requirements_state": "complete",
        "requires_interaction": false,
        "risk": "normal",
        "task_type": "implementation"
      },
      "oracle_eligible": {
        "routing.interaction_required": true,
        "routing.semantic_risk": true,
        "routing.task_class": true
      },
      "task": "Implement a feature flag that disables the experimental parser without removing its code."
    },
    {
      "case_id": "rsv1-011",
      "metadata": {
        "environment": "development",
        "requires_interaction": false,
        "risk": "normal",
        "symptom_scope": "reproducible",
        "task_type": "research"
      },
      "oracle_eligible": {
        "routing.interaction_required": true,
        "routing.semantic_risk": true,
        "routing.task_class": true
      },
      "task": "Investigate why the worker occasionally processes the same queued job twice and identify the likely failure path."
    },
    {
      "case_id": "rsv1-012",
      "metadata": {
        "environment": "development",
        "requires_interaction": false,
        "risk": "normal",
        "symptom_scope": "reproducible",
        "task_type": "exploratory"
      },
      "oracle_eligible": {
        "routing.interaction_required": true,
        "routing.semantic_risk": true,
        "routing.task_class": true
      },
      "task": "Diagnose the source of a memory increase that appears after repeated document imports."
    },
    {
      "case_id": "rsv1-013",
      "metadata": {
        "environment": "development",
        "requires_interaction": false,
        "risk": "normal",
        "symptom_scope": "reproducible",
        "task_type": "research"
      },
      "oracle_eligible": {
        "routing.interaction_required": true,
        "routing.semantic_risk": true,
        "routing.task_class": true
      },
      "task": "Trace why the CLI exits with code 0 even when one requested file cannot be parsed."
    },
    {
      "case_id": "rsv1-014",
      "metadata": {
        "environment": "development",
        "requires_interaction": false,
        "risk": "normal",
        "symptom_scope": "reproducible",
        "task_type": "exploratory"
      },
      "oracle_eligible": {
        "routing.interaction_required": true,
        "routing.semantic_risk": true,
        "routing.task_class": true
      },
      "task": "Investigate a flaky test that fails only when the full integration suite runs in parallel."
    },
    {
      "case_id": "rsv1-015",
      "metadata": {
        "environment": "development",
        "requires_interaction": false,
        "risk": "normal",
        "symptom_scope": "reproducible",
        "task_type": "research"
      },
      "oracle_eligible": {
        "routing.interaction_required": true,
        "routing.semantic_risk": true,
        "routing.task_class": true
      },
      "task": "Determine why the cache hit rate dropped after the latest serialization change."
    },
    {
      "case_id": "rsv1-016",
      "metadata": {
        "environment": "development",
        "requires_interaction": false,
        "risk": "normal",
        "symptom_scope": "reproducible",
        "task_type": "exploratory"
      },
      "oracle_eligible": {
        "routing.interaction_required": true,
        "routing.semantic_risk": true,
        "routing.task_class": true
      },
      "task": "Analyze why Windows path normalization differs from Linux for nested worktrees."
    },
    {
      "case_id": "rsv1-017",
      "metadata": {
        "environment": "development",
        "requires_interaction": false,
        "risk": "normal",
        "symptom_scope": "reproducible",
        "task_type": "research"
      },
      "oracle_eligible": {
        "routing.interaction_required": true,
        "routing.semantic_risk": true,
        "routing.task_class": true
      },
      "task": "Find the cause of duplicate audit events emitted during workflow retry recovery."
    },
    {
      "case_id": "rsv1-018",
      "metadata": {
        "environment": "development",
        "requires_interaction": false,
        "risk": "normal",
        "symptom_scope": "reproducible",
        "task_type": "exploratory"
      },
      "oracle_eligible": {
        "routing.interaction_required": true,
        "routing.semantic_risk": true,
        "routing.task_class": true
      },
      "task": "Investigate why a scheduled cleanup does not remove expired temporary records."
    },
    {
      "case_id": "rsv1-019",
      "metadata": {
        "environment": "development",
        "requires_interaction": false,
        "risk": "normal",
        "symptom_scope": "reproducible",
        "task_type": "research"
      },
      "oracle_eligible": {
        "routing.interaction_required": true,
        "routing.semantic_risk": true,
        "routing.task_class": true
      },
      "task": "Trace a latency regression in the report endpoint without changing production behavior yet."
    },
    {
      "case_id": "rsv1-020",
      "metadata": {
        "environment": "development",
        "requires_interaction": false,
        "risk": "normal",
        "symptom_scope": "reproducible",